{
  "$schema": "./schema.json",
  "sku": "spot-vol-beta",
  "cadence": "1d-close",
  "signal": 2,
  "deskBeta": -0.7,
  "formula": "UV_Δ − (−0.70 × SPX%)",
  "formulaLabel": "desk estimate",
  "note": "A print at or above 2 is the house possible-bottom signal. A formal vol event is a VIX close move of 2 points or more. After a formal event, the house path is back toward the prior SPX close inside about three weeks.",
  "points": [
    {
      "date": "2026-08-03",
      "svb": 0.56,
      "spx": 6529.46
    },
    {
      "date": "2026-08-04",
      "svb": 0.55,
      "spx": 6539.89
    },
    {
      "date": "2026-08-05",
      "svb": 0.55,
      "spx": 6550.43
    },
    {
      "date": "2026-08-06",
      "svb": 0.62,
      "spx": 6564.21
    },
    {
      "date": "2026-08-07",
      "svb": 0.55,
      "spx": 6568.09
    },
    {
      "date": "2026-08-10",
      "svb": 0.47,
      "spx": 6579.59
    },
    {
      "date": "2026-08-11",
      "svb": 0.5,
      "spx": 6595.01
    },
    {
      "date": "2026-08-12",
      "svb": 0.62,
      "spx": 6616.5
    },
    {
      "date": "2026-08-13",
      "svb": 0.52,
      "spx": 6619.05
    },
    {
      "date": "2026-08-14",
      "svb": 0.48,
      "spx": 6633.05
    },
    {
      "date": "2026-08-17",
      "svb": 0.52,
      "spx": 6647.18
    },
    {
      "date": "2026-08-18",
      "svb": 0.51,
      "spx": 6671.37
    },
    {
      "date": "2026-08-19",
      "svb": 0.6,
      "spx": 6682.33
    },
    {
      "date": "2026-08-20",
      "svb": 0.61,
      "spx": 6699.76
    },
    {
      "date": "2026-08-21",
      "svb": 0.58,
      "spx": 6701.67
    },
    {
      "date": "2026-08-24",
      "svb": 0.65,
      "spx": 6714.14
    },
    {
      "date": "2026-08-25",
      "svb": 0.71,
      "spx": 6717.14
    },
    {
      "date": "2026-08-26",
      "svb": 0.64,
      "spx": 6723.08
    },
    {
      "date": "2026-08-27",
      "svb": 0.54,
      "spx": 6725.62
    },
    {
      "date": "2026-08-28",
      "svb": 0.45,
      "spx": 6726.51
    },
    {
      "date": "2026-08-31",
      "svb": 0.61,
      "spx": 6728.73
    },
    {
      "date": "2026-09-01",
      "svb": 0.62,
      "spx": 6732.79
    },
    {
      "date": "2026-09-02",
      "svb": 1.86,
      "spx": 6672.19,
      "vixCloseMove": 1.6
    },
    {
      "date": "2026-09-03",
      "svb": 2.64,
      "spx": 6552.09,
      "vixCloseMove": 2.6
    },
    {
      "date": "2026-09-04",
      "svb": 2.18,
      "spx": 6506.23,
      "vixCloseMove": 2.1
    },
    {
      "date": "2026-09-08",
      "svb": 1.47,
      "spx": 6545.27
    },
    {
      "date": "2026-09-09",
      "svb": 1.28,
      "spx": 6568.27
    },
    {
      "date": "2026-09-10",
      "svb": 1.16,
      "spx": 6574.54
    },
    {
      "date": "2026-09-11",
      "svb": 0.95,
      "spx": 6584.93
    },
    {
      "date": "2026-09-14",
      "svb": 0.81,
      "spx": 6588.8
    },
    {
      "date": "2026-09-15",
      "svb": 0.65,
      "spx": 6598.92
    },
    {
      "date": "2026-09-16",
      "svb": 0.68,
      "spx": 6612.35
    },
    {
      "date": "2026-09-17",
      "svb": 0.7,
      "spx": 6634.29
    },
    {
      "date": "2026-09-18",
      "svb": 0.6,
      "spx": 6633.74
    },
    {
      "date": "2026-09-21",
      "svb": 0.59,
      "spx": 6629.99
    },
    {
      "date": "2026-09-22",
      "svb": 0.65,
      "spx": 6651.5
    },
    {
      "date": "2026-09-23",
      "svb": 0.61,
      "spx": 6651.76
    },
    {
      "date": "2026-09-24",
      "svb": 0.7,
      "spx": 6670.06
    },
    {
      "date": "2026-09-25",
      "svb": 0.64,
      "spx": 6682.26
    },
    {
      "date": "2026-09-28",
      "svb": 0.67,
      "spx": 6677.68
    },
    {
      "date": "2026-09-29",
      "svb": 0.64,
      "spx": 6697.53
    },
    {
      "date": "2026-09-30",
      "svb": 0.57,
      "spx": 6703.94
    },
    {
      "date": "2026-10-01",
      "svb": 0.5,
      "spx": 6706.21
    },
    {
      "date": "2026-10-02",
      "svb": 0.46,
      "spx": 6722.41
    },
    {
      "date": "2026-10-05",
      "svb": 0.54,
      "spx": 6738.69
    },
    {
      "date": "2026-10-06",
      "svb": 0.54,
      "spx": 6741.19
    },
    {
      "date": "2026-10-07",
      "svb": 0.52,
      "spx": 6752.54
    },
    {
      "date": "2026-10-08",
      "svb": 0.49,
      "spx": 6763.57
    },
    {
      "date": "2026-10-09",
      "svb": 1.58,
      "spx": 6736.52
    },
    {
      "date": "2026-10-12",
      "svb": 2.11,
      "spx": 6662.42,
      "vixCloseMove": 1.4
    },
    {
      "date": "2026-10-13",
      "svb": 1.36,
      "spx": 6689.07
    },
    {
      "date": "2026-10-14",
      "svb": 1.13,
      "spx": 6706.01
    },
    {
      "date": "2026-10-15",
      "svb": 0.97,
      "spx": 6726.91
    },
    {
      "date": "2026-10-16",
      "svb": 0.9,
      "spx": 6721.49
    },
    {
      "date": "2026-10-19",
      "svb": 0.84,
      "spx": 6730.24
    },
    {
      "date": "2026-10-20",
      "svb": 0.89,
      "spx": 6755.21
    },
    {
      "date": "2026-10-21",
      "svb": 0.77,
      "spx": 6760.32
    },
    {
      "date": "2026-10-22",
      "svb": 0.95,
      "spx": 6769.93
    },
    {
      "date": "2026-10-23",
      "svb": 1.11,
      "spx": 6784.18
    },
    {
      "date": "2026-10-26",
      "svb": 1.27,
      "spx": 6812.35
    },
    {
      "date": "2026-10-27",
      "svb": 1.43,
      "spx": 6838.9
    },
    {
      "date": "2026-10-28",
      "svb": 1.59,
      "spx": 6856.15
    },
    {
      "date": "2026-10-29",
      "svb": 1.84,
      "spx": 6874.4
    }
  ]
}
